{
  "$schema": "https://json-schema.org/draft/2020-12/schema",
  "$id": "https://github.com/vincemakes/model-boss/config/model-boss.schema.json",
  "title": "Model Boss configuration",
  "description": "Credential-free, model-independent Model Boss route configuration.",
  "type": "object",
  "additionalProperties": false,
  "required": [
    "schema_version"
  ],
  "properties": {
    "schema_version": {
      "const": 1
    },
    "mode": {
      "enum": [
        "auto",
        "lite",
        "max"
      ]
    },
    "routes": {
      "type": "object",
      "propertyNames": {
        "type": "string",
        "minLength": 1,
        "pattern": ".*\\S.*"
      },
      "additionalProperties": {
        "$ref": "#/$defs/route"
      }
    },
    "preferences": {
      "$ref": "#/$defs/preferences"
    }
  },
  "$defs": {
    "routeIdList": {
      "type": "array",
      "items": {
        "type": "string",
        "minLength": 1,
        "pattern": ".*\\S.*"
      },
      "uniqueItems": true
    },
    "preferences": {
      "type": "object",
      "additionalProperties": false,
      "properties": {
        "reviewers": {
          "$ref": "#/$defs/routeIdList"
        },
        "workers": {
          "$ref": "#/$defs/routeIdList"
        },
        "scouts": {
          "$ref": "#/$defs/routeIdList"
        },
        "mechanics": {
          "$ref": "#/$defs/routeIdList"
        }
      }
    },
    "retryPolicy": {
      "type": "object",
      "additionalProperties": false,
      "properties": {
        "worker_attempts": {
          "type": "integer",
          "minimum": 0,
          "maximum": 10,
          "default": 3
        },
        "review_revisions": {
          "type": "integer",
          "minimum": 0,
          "maximum": 10,
          "default": 2
        }
      }
    },
    "environmentName": {
      "type": "string",
      "pattern": "^[A-Z][A-Z0-9_]*$"
    },
    "credentialBinding": {
      "type": "object",
      "additionalProperties": false,
      "required": [
        "child_name",
        "source_name"
      ],
      "properties": {
        "child_name": {
          "$ref": "#/$defs/environmentName"
        },
        "source_name": {
          "$ref": "#/$defs/environmentName"
        }
      }
    },
    "command": {
      "type": "array",
      "minItems": 1,
      "prefixItems": [
        {
          "type": "string",
          "minLength": 1,
          "pattern": ".*\\S.*"
        }
      ],
      "items": {
        "type": "string"
      }
    },
    "route": {
      "type": "object",
      "additionalProperties": false,
      "required": [
        "transport",
        "band",
        "roles",
        "read_only"
      ],
      "properties": {
        "transport": {
          "enum": [
            "host-subagent",
            "external-cli"
          ]
        },
        "band": {
          "enum": [
            "authority",
            "balanced",
            "fast"
          ]
        },
        "roles": {
          "type": "array",
          "minItems": 1,
          "uniqueItems": true,
          "items": {
            "enum": [
              "reviewer",
              "worker",
              "scout",
              "mechanic"
            ]
          }
        },
        "read_only": {
          "type": "boolean"
        },
        "model": {
          "type": [
            "string",
            "null"
          ],
          "minLength": 1,
          "pattern": ".*\\S.*"
        },
        "provider_family": {
          "type": [
            "string",
            "null"
          ],
          "minLength": 1,
          "pattern": ".*\\S.*"
        },
        "variant": {
          "type": [
            "string",
            "null"
          ],
          "minLength": 1,
          "pattern": ".*\\S.*"
        },
        "command": {
          "$ref": "#/$defs/command"
        },
        "timeout_seconds": {
          "type": "integer",
          "minimum": 1,
          "default": 600
        },
        "retry_policy": {
          "$ref": "#/$defs/retryPolicy"
        },
        "credential_env": {
          "type": "array",
          "items": {
            "$ref": "#/$defs/credentialBinding"
          }
        },
        "effort": {
          "description": "Effort level pinned for spawned calls on this route; the model catalog decides which levels a pinned model accepts.",
          "enum": [
            "low",
            "medium",
            "high",
            "xhigh",
            "max",
            null
          ]
        },
        "quota_weight": {
          "description": "Relative scarcity of this route's quota for dispatch estimates (1.0 = price proxy).",
          "type": "number",
          "exclusiveMinimum": 0,
          "default": 1.0
        },
        "aliases": {
          "description": "Additional spoken names that match this route in a user request.",
          "type": "array",
          "items": {
            "type": "string",
            "minLength": 1,
            "pattern": ".*\\S.*"
          },
          "uniqueItems": true
        }
      },
      "allOf": [
        {
          "if": {
            "properties": {
              "transport": {
                "const": "external-cli"
              }
            },
            "required": [
              "transport"
            ]
          },
          "then": {
            "required": [
              "command"
            ]
          },
          "else": {
            "not": {
              "required": [
                "command"
              ]
            }
          }
        },
        {
          "if": {
            "properties": {
              "roles": {
                "contains": {
                  "const": "reviewer"
                }
              }
            },
            "required": [
              "roles"
            ]
          },
          "then": {
            "properties": {
              "read_only": {
                "const": true
              }
            }
          }
        }
      ]
    }
  }
}
